{"$id": "https://example.invalid/splay-am-pd/schemas/wp5_post_n7_candidate_v0.1.schema.json", "$schema": "https://json-schema.org/draft/2020-12/schema", "description": "SA-03 ERA-B post-n7 universal-candidate freeze record (WP-5). Untouched n7 claims are schema-invalid.", "properties": {"b_H": {"properties": {"p": {"type": "string"}, "q": {"type": "string"}}, "required": ["p", "q"], "type": "object"}, "candidate_era": {"const": "POST_N7", "type": "string"}, "candidate_source_hash": {"type": "string"}, "coefficient_domain": {"type": "string"}, "definition": {"type": "string"}, "development_evidence": {"type": "array"}, "discovery_sizes": {"items": {"type": "integer"}, "type": "array"}, "evaluation_source_hash": {"type": "string"}, "formula_H": {"type": "string"}, "git_commit": {"type": "string"}, "heldout_sizes": {"items": {"type": "integer"}, "type": "array"}, "hypothesis_id": {"type": "string"}, "manifest_sha256": {"type": "string"}, "n7_status": {"const": "REVEALED_DEVELOPMENT_DATA", "type": "string"}, "normalization": {"type": "string"}, "og_diagnostics": {"type": "object"}, "parent_hypothesis": {"type": ["string", "null"]}, "provenance": {"type": "string"}, "schema_version": {"type": "string"}, "state_only": {"type": "boolean", "const": true}, "structural_definitions": {"type": "string"}, "tie_breaking_rules": {"type": "string"}, "timestamp_meta": {"type": "string"}, "uh_status": {"type": "object"}, "untouched_sizes": {"items": {"type": "integer"}, "not": {"contains": {"const": 7}}, "type": "array"}, "uses_b_n_star_table": {"type": "boolean", "const": false}, "uses_history": {"type": "boolean", "const": false}}, "required": ["hypothesis_id", "formula_H", "tie_breaking_rules", "normalization", "structural_definitions", "b_H", "candidate_source_hash", "evaluation_source_hash", "schema_version", "provenance", "development_evidence", "og_diagnostics", "uh_status", "candidate_era", "n7_status", "untouched_sizes", "state_only", "uses_history", "uses_b_n_star_table"], "title": "WP-5 post-n7 candidate v0.1 (SA-03)", "type": "object"}
